"Entry","Entry name","Status","Gene names","product","Length","Keywords","Protein families","Cross-reference (KEGG)",,,,,,,,,,
"O05442","CPNT_MYCTU","reviewed","cpnT Rv3903c","Outer membrane channel protein CpnT (Channel protein with necrosis-inducing toxin) [Cleaved into: N-terminal channel domain; Tuberculosis necrotizing toxin (TNT) (NAD(+) glycohydrolase) (EC 3.2.2.5)]",846,"3D-structure;Cell outer membrane;Complete proteome;Host cytoplasm;Hydrolase;Ion transport;Membrane;NAD;Porin;Reference proteome;Secreted;Toxin;Transmembrane;Transmembrane beta strand;Transport;Virulence",,"mtu:Rv3903c;mtv:RVBD_3903c;",,,,,,,,,,
"P9WNK7","ESXA_MYCTU","reviewed","esxA esaT6 Rv3875 MTV027.10","6 kDa early secretory antigenic target (ESAT-6)",95,"3D-structure;Acetylation;Apoptosis;Cell wall;Coiled coil;Complete proteome;Direct protein sequencing;Host cell membrane;Host cytoplasm;Host endoplasmic reticulum;Host membrane;Membrane;Reference proteome;Secreted;Transmembrane;Transmembrane helix;Virulence","WXG100 family"," ESAT-6 subfamily","mtu:Rv3875;",,,,,,,,,
"P9WGR1","INHA_MYCTU","reviewed","inhA Rv1484 MTCY277.05","Enoyl-[acyl-carrier-protein] reductase [NADH] (ENR) (Enoyl-ACP reductase) (EC 1.3.1.9) (FAS-II enoyl-ACP reductase) (NADH-dependent 2-trans-enoyl-ACP reductase)",269,"3D-structure;Antibiotic resistance;Complete proteome;Fatty acid biosynthesis;Fatty acid metabolism;Lipid biosynthesis;Lipid metabolism;NAD;Oxidoreductase;Phosphoprotein;Reference proteome","Short-chain dehydrogenases/reductases (SDR) family"," FabI subfamily","mtu:Rv1484;",,,,,,,,,
"P9WJF1","DPRE1_MYCTU","reviewed","dprE1 Rv3790","Decaprenylphosphoryl-beta-D-ribose oxidase (EC 1.1.98.3) (Decaprenylphospho-beta-D-ribofuranose 2-dehydrogenase) (Decaprenylphosphoryl-beta-D-ribofuranose 2'-epimerase subunit DprE1) (Decaprenyl-phosphoribose 2'-epimerase subunit 1) (Decaprenylphosphoryl-beta-D-ribofuranose 2'-oxidase) (Decaprenylphosphoryl-beta-D-ribose 2-epimerase flavoprotein subunit) (FAD-dependent decaprenylphosphoryl-beta-D-ribofuranose 2-oxidase)",461,"3D-structure;Antibiotic resistance;Cell wall biogenesis/degradation;Complete proteome;FAD;Flavoprotein;Oxidoreductase;Periplasm;Reference proteome","DprE1 family","mtu:Rv3790;",,,,,,,,,,
"P9WI81","PKNB_MYCTU","reviewed","pknB Rv0014c MTCY10H4.14c","Serine/threonine-protein kinase PknB (EC 2.7.11.1)",626,"3D-structure;ATP-binding;Acetylation;Cell membrane;Complete proteome;Direct protein sequencing;Kinase;Magnesium;Membrane;Metal-binding;Nucleotide-binding;Phosphoprotein;Reference proteome;Repeat;Serine/threonine-protein kinase;Transferase;Transmembrane;Transmembrane helix;Virulence","Protein kinase superfamily"," Ser/Thr protein kinase family","mtu:Rv0014c;",,,,,,,,,
"P9WGK3","DEVS_MYCTU","reviewed","devS dosS Rv3132c","Oxygen sensor histidine kinase response regulator DevS/DosS (EC 2.7.13.3)",578,"3D-structure;ATP-binding;Acetylation;Complete proteome;Cytoplasm;Heme;Iron;Kinase;Magnesium;Metal-binding;Nucleotide-binding;Phosphoprotein;Reference proteome;Repeat;Transferase;Two-component regulatory system",,"mtu:Rv3132c;",,,,,,,,,,
"P9WG47","GYRA_MYCTU","reviewed","gyrA Rv0006 MTCY10H4.04","DNA gyrase subunit A (EC 5.99.1.3) (Type IIA topoisomerase subunit GyrA)",838,"3D-structure;ATP-binding;Acetylation;Antibiotic resistance;Calcium;Complete proteome;Cytoplasm;DNA-binding;Isomerase;Nucleotide-binding;Reference proteome;Topoisomerase","Type II topoisomerase GyrA/ParC subunit family","mtu:Rv0006;",,,,,,,,,,
"P9WNK5","ESXB_MYCTU","reviewed","esxB cfp10 lhp mtsA10 Rv3874 MTV027.09","ESAT-6-like protein EsxB (10 kDa culture filtrate antigen CFP-10) (CFP-10) (Secreted antigenic protein MTSA-10)",100,"3D-structure;Acetylation;Cell wall;Chaperone;Coiled coil;Complete proteome;Direct protein sequencing;Host endoplasmic reticulum;Reference proteome;Secreted;Virulence","WXG100 family"," CFP-10 subfamily","mtu:Rv3874;",,,,,,,,,
"P9WIF5","PG33_MYCTU","reviewed","PE_PGRS33 Rv1818c MTCY1A11.25c","PE-PGRS family protein PE_PGRS33",498,"Calcium;Cell outer membrane;Cell wall;Complete proteome;Membrane;Reference proteome;Secreted;Virulence","Mycobacterial PE family"," PGRS subfamily","mtu:Rv1818c;mtv:RVBD_1818c;",,,,,,,,,
"P9WIE5","KATG_MYCTU","reviewed","katG Rv1908c MTCY180.10","Catalase-peroxidase (CP) (EC 1.11.1.21) (Peroxidase/catalase)",740,"3D-structure;Antibiotic resistance;Complete proteome;Heme;Hydrogen peroxide;Iron;Metal-binding;Organic radical;Oxidoreductase;Peroxidase;Reference proteome;Virulence","Peroxidase family"," Peroxidase/catalase subfamily","mtu:Rv1908c;",,,,,,,,,
"P9WMF9","DEVR_MYCTU","reviewed","devR dosR Rv3133c","DNA-binding transcriptional activator DevR/DosR",217,"3D-structure;Activator;Complete proteome;Cytoplasm;DNA-binding;Host cytoplasmic vesicle;Phosphoprotein;Reference proteome;Transcription;Transcription regulation;Two-component regulatory system",,"mtu:Rv3133c;",,,,,,,,,,
"P9WK61","LPQH_MYCTU","reviewed","lpqH Rv3763 MTV025.111","Lipoprotein LpqH (19 kDa lipoprotein antigen) (Putative transporter LpqH) (p19)",159,"3D-structure;Cell membrane;Cell wall;Complete proteome;Disulfide bond;Glycoprotein;Host cytoplasm;Lipoprotein;Membrane;Palmitate;Reference proteome;Secreted;Signal;Transport;Virulence","Mycobacterial 19 kDa antigen family","mtu:Rv3763;",,,,,,,,,,
"P9WMK1","ACR_MYCTU","reviewed","hspX acr Rv2031c MTV018.18c","Alpha-crystallin (Acr) (14 kDa antigen) (16 kDa antigen) (HSP 16.3) (Nox16)",144,"Cell wall;Chaperone;Complete proteome;Cytoplasm;Direct protein sequencing;Isopeptide bond;Reference proteome;Secreted;Ubl conjugation","Small heat shock protein (HSP20) family","mtu:Rv2031c;",,,,,,,,,,
"P9WHU1","PSA_MYCTU","reviewed","prcA Rv2109c","Proteasome subunit alpha (EC 3.4.25.1) (20S proteasome alpha subunit) (Proteasome core protein PrcA)",248,"3D-structure;Acetylation;Complete proteome;Cytoplasm;Direct protein sequencing;Hydrolase;Phosphoprotein;Protease;Proteasome;Reference proteome;Threonine protease;Virulence","Peptidase T1A family","mtu:Rv2109c;",,,,,,,,,,
"P9WKD3","BLAC_MYCTU","reviewed","blaC blaA Rv2068c MTCY49.07c","Beta-lactamase (EC 3.5.2.6) (Ambler class A beta-lactamase)",307,"3D-structure;Antibiotic resistance;Cell inner membrane;Cell membrane;Complete proteome;Hydrolase;Membrane;Periplasm;Reference proteome;Secreted;Signal","Class-A beta-lactamase family","mtu:Rv2068c;",,,,,,,,,,
"P9WHT9","PSB_MYCTU","reviewed","prcB Rv2110c","Proteasome subunit beta (EC 3.4.25.1) (20S proteasome beta subunit) (Proteasome core protein PrcB)",291,"3D-structure;Autocatalytic cleavage;Complete proteome;Cytoplasm;Direct protein sequencing;Hydrolase;Phosphoprotein;Protease;Proteasome;Reference proteome;Threonine protease;Virulence;Zymogen","Peptidase T1B family","mtu:Rv2110c;",,,,,,,,,,
"P9WGU1","PSTS1_MYCTU","reviewed","pstS1 phoS1 Rv0934 MTCY08D9.05c","Phosphate-binding protein PstS 1 (PBP 1) (PhoS1) (PstS-1) (38-kDa glycolipoprotein) (38-kDa lipoprotein) (P38) (Antigen Ag78) (Protein antigen B) (Pab)",374,"3D-structure;Cell adhesion;Cell membrane;Cell wall;Complete proteome;Glycoprotein;Lipoprotein;Membrane;Palmitate;Phosphate transport;Reference proteome;Secreted;Signal;Transport;Virulence","PstS family","mtu:Rv0934;",,,,,,,,,,
"P9WK45","LPRG_MYCTU","reviewed","lprG lpp-27 Rv1411c MTCY21B4.28c","Lipoarabinomannan carrier protein LprG (27 kDa lipoprotein) (Antigen P27) (Lipoprotein LprG) (Triacylated glycolipid carrier LprG) (Triacylglyceride transfer protein LprG)",236,"3D-structure;Antibiotic resistance;Cell inner membrane;Cell membrane;Cell wall;Complete proteome;Glycoprotein;Lipid transport;Lipid-binding;Lipoprotein;Membrane;Palmitate;Reference proteome;Secreted;Signal;Transport;Virulence","LppX/LprAFG lipoprotein family","mtu:Rv1411c;",,,,,,,,,,
"P9WG45","GYRB_MYCTU","reviewed","gyrB Rv0005 MTCY10H4.03","DNA gyrase subunit B (EC 5.99.1.3)",675,"3D-structure;ATP-binding;Antibiotic resistance;Complete proteome;Cytoplasm;DNA-binding;Isomerase;Magnesium;Metal-binding;Nucleotide-binding;Reference proteome;Topoisomerase","Type II topoisomerase GyrB family","mtu:Rv0005;",,,,,,,,,,
"P9WJE1","ESPA_MYCTU","reviewed","espA Rv3616c","ESX-1 secretion-associated protein EspA",392,"Complete proteome;Disulfide bond;Reference proteome;Secreted;Virulence",,"mtu:Rv3616c;",,,,,,,,,,
"P9WG29","RPFB_MYCTU","reviewed","rpfB Rv1009 MTC1237.26","Resuscitation-promoting factor RpfB (EC 3.-.-.-)",362,"3D-structure;Cell membrane;Complete proteome;Disulfide bond;Hydrolase;Lipoprotein;Membrane;Palmitate;Reference proteome;Signal;Virulence","Transglycosylase family"," Rpf subfamily","mtu:Rv1009;",,,,,,,,,
"P9WN39","GLN1B_MYCTU","reviewed","glnA1 glnA Rv2220 MTCY190.31 MTCY427.01","Glutamine synthetase (GS) (EC 6.3.1.2) (Glutamate--ammonia ligase) (Glutamine synthetase I beta) (GSI beta)",478,"3D-structure;ATP-binding;Complete proteome;Cytoplasm;Direct protein sequencing;Ligase;Magnesium;Metal-binding;Nucleotide-binding;Phosphoprotein;Reference proteome;Virulence","Glutamine synthetase family","mtu:Rv2220;",,,,,,,,,,
"P9WPE7","CH602_MYCTU","reviewed","groEL2 groEL-2 groL2 hsp65 mtc28 Rv0440 MTV037.04","60 kDa chaperonin 2 (65 kDa antigen) (Antigen A) (Cell wall protein A) (GroEL protein 2) (Heat shock protein 65) (Protein Cpn60-2)",540,"3D-structure;ATP-binding;Chaperone;Complete proteome;Cytoplasm;Isopeptide bond;Nucleotide-binding;Reference proteome;Secreted;Ubl conjugation","Chaperonin (HSP60) family","mtu:Rv0440;",,,,,,,,,,
"P9WFK7","EIS_MYCTU","reviewed","eis Rv2416c MTCY253.04","N-acetyltransferase Eis (EC 2.3.1.-) (Aminoglycoside N-acetyltransferase) (Enhanced intracellular survival protein) (Protein-lysine N-acetyltransferase)",402,"3D-structure;Acyltransferase;Antibiotic resistance;Complete proteome;Direct protein sequencing;Host cytoplasmic vesicle;Reference proteome;Secreted;Transferase","Acetyltransferase Eis family","mtu:Rv2416c;mtv:RVBD_2416c;",,,,,,,,,,
"P9WPE5","CH10_MYCTU","reviewed","groS cpn10 groES mopB Rv3418c MTCY78.11","10 kDa chaperonin (10 kDa antigen) (BCG-A heat shock protein) (GroES protein) (Protein Cpn10)",100,"3D-structure;Acetylation;Chaperone;Complete proteome;Cytoplasm;Direct protein sequencing;Isopeptide bond;Reference proteome;Stress response;Ubl conjugation","GroES chaperonin family","mtu:Rv3418c;",,,,,,,,,,
"P9WF41","WHIB3_MYCTU","reviewed","whiB3 Rv3416","Redox- and pH-responsive transcriptional regulator WhiB3",102,"4Fe-4S;Complete proteome;Cytoplasm;DNA-binding;Disulfide bond;Iron;Iron-sulfur;Metal-binding;Reference proteome;Stress response;Transcription;Transcription regulation;Virulence","WhiB family","mtu:Rv3416;",,,,,,,,,,
"P9WI45","PPE03_MYCTU","reviewed","PPE3 Rv0280","Uncharacterized PPE family protein PPE3",536,"Complete proteome;Reference proteome","Mycobacterial PPE family","mtu:Rv0280;",,,,,,,,,,
"P9WI43","PPE04_MYCTU","reviewed","PPE4 Rv0286","PPE family protein PPE4",513,"Cell membrane;Complete proteome;Membrane;Reference proteome;Transmembrane;Transmembrane helix","Mycobacterial PPE family","mtu:Rv0286;",,,,,,,,,,
"P9WI41","PPE10_MYCTU","reviewed","PPE10 Rv0442c MTV037.06c","Uncharacterized PPE family protein PPE10",487,"Complete proteome;Reference proteome","Mycobacterial PPE family","mtu:Rv0442c;",,,,,,,,,,
"P9WI37","PPE12_MYCTU","reviewed","PPE12 Rv0755c","Uncharacterized PPE family protein PPE12",645,"Complete proteome;Reference proteome","Mycobacterial PPE family","mtu:Rv0755c;",,,,,,,,,,
"P9WHW7","PPE69_MYCTU","reviewed","PPE69 Rv3892c","Uncharacterized PPE family protein PPE69",399,"Complete proteome;Reference proteome","Mycobacterial PPE family","mtu:Rv3892c;",,,,,,,,,,
"P9WI07","PPE30_MYCTU","reviewed","PPE30 Rv1802 MTV049.24","Uncharacterized PPE family protein PPE30",463,"Complete proteome;Reference proteome","Mycobacterial PPE family","mtu:Rv1802;mtv:RVBD_1802;",,,,,,,,,,
"P9WI05","PPE32_MYCTU","reviewed","PPE32 Rv1808","Uncharacterized PPE family protein PPE32",409,"Complete proteome;Reference proteome","Mycobacterial PPE family","mtu:Rv1808;mtv:RVBD_1808;",,,,,,,,,,
"Q79FI9","PPE34_MYCTU","reviewed","PPE34 Rv1917c","PPE family protein PPE34",1459,"Cell membrane;Cell wall;Complete proteome;Membrane;Reference proteome;Secreted;Virulence","Mycobacterial PPE family","mtu:Rv1917c;mtv:RVBD_1917c;",,,,,,,,,,
"P9WI01","PPE36_MYCTU","reviewed","PPE36 p27 Rv2108","Uncharacterized PPE family protein PPE36",243,"Cell membrane;Complete proteome;Direct protein sequencing;Membrane;Reference proteome","Mycobacterial PPE family","mtu:Rv2108;",,,,,,,,,,
"P9WHW1","PPIB_MYCTU","reviewed","ppiB ppi Rv2582 MTCY227.19c","Probable peptidyl-prolyl cis-trans isomerase B (PPIase B) (EC 5.2.1.8) (Rotamase B)",308,"Complete proteome;Isomerase;Reference proteome;Rotamase","Cyclophilin-type PPIase family","mtu:Rv2582;mtv:RVBD_2582;",,,,,,,,,,
"P9WH17","RIMP_MYCTU","reviewed","rimP Rv2842c MTCY24A1.15","Ribosome maturation factor RimP",183,"Complete proteome;Cytoplasm;Reference proteome;Ribosome biogenesis","RimP family","mtu:Rv2842c;",,,,,,,,,,
"P9WMP1","PPOX_MYCTU","reviewed","hemY Rv2677c MTV010.01c","Protoporphyrinogen oxidase (PPO) (EC 1.3.3.4)",452,"Complete proteome;Cytoplasm;FAD;Flavoprotein;Heme biosynthesis;Membrane;Oxidoreductase;Porphyrin biosynthesis;Reference proteome","Protoporphyrinogen oxidase family","mtu:Rv2677c;",,,,,,,,,,
"P9WQE1","PPSE_MYCTU","reviewed","ppsE Rv2935","Phthiocerol synthesis polyketide synthase type I PpsE (Beta-ketoacyl-acyl-carrier-protein synthase I) (EC 2.3.1.41)",1488,"Acetylation;Complete proteome;Fatty acid metabolism;Lipid metabolism;Multifunctional enzyme;NADP;Oxidoreductase;Phosphopantetheine;Phosphoprotein;Reference proteome;Transferase",,"mtu:Rv2935;",,,,,,,,,,
"O53168","RIPA_MYCTU","reviewed","ripA Rv1477","Peptidoglycan endopeptidase RipA (EC 3.4.-.-) (Macrophage invasion and intracellular persistence protein A) (Resuscitation-promoting factor interaction partner A) (Rpf-interacting protein A)",472,"3D-structure;Cell wall biogenesis/degradation;Complete proteome;Hydrolase;Protease;Reference proteome;Secreted;Signal;Thiol protease","Peptidase C40 family","mtu:Rv1477;",,,,,,,,,,
"P9WH69","RIR2H_MYCTU","reviewed","nrdB Rv0233","R2-like ligand binding oxidase (EC 1.-.-.-) (Ribonucleotide reductase R2 subunit homolog) (Ribonucleotide reductase small subunit homolog)",314,"3D-structure;Complete proteome;Iron;Lipoprotein;Manganese;Metal-binding;Oxidoreductase;Reference proteome","Ribonucleoside diphosphate reductase small chain family"," R2-like ligand binding oxidase subfamily","mtu:Rv0233;",,,,,,,,,
"P9WIM7","PRA_MYCTU","reviewed","pra Rv1078 MTV017.31","Proline-rich antigen homolog",240,"Complete proteome;Reference proteome;Repeat",,"mtu:Rv1078;",,,,,,,,,,
"P9WIC3","PHEA_MYCTU","reviewed","pheA Rv3838c","Prephenate dehydratase (PDT) (EC 4.2.1.51)",321,"Allosteric enzyme;Amino-acid biosynthesis;Aromatic amino acid biosynthesis;Complete proteome;Lyase;Phenylalanine biosynthesis;Reference proteome",,"mtu:Rv3838c;",,,,,,,,,,
"P9WPG5","PGSA1_MYCTU","reviewed","pgsA1 pgsA pgsA2 Rv1822 MTCY1A11.21c","Putative CDP-diacylglycerol--glycerol-3-phosphate 3-phosphatidyl-transferase 1 (EC 2.7.8.5) (Phosphatidylglycerophosphate synthase) (PGP synthase)",209,"Cell membrane;Complete proteome;Lipid biosynthesis;Lipid metabolism;Membrane;Phospholipid biosynthesis;Phospholipid metabolism;Reference proteome;Transferase;Transmembrane;Transmembrane helix","CDP-alcohol phosphatidyltransferase class-I family","mtu:Rv1822;",,,,,,,,,,
"O53901","PKS5_MYCTU","reviewed","pks5 Rv1527c LH57_08370","Mycocerosic acid synthase-like polyketide synthase (MAS-like PKS) (EC 2.3.1.-) (Polyketide synthase Pks5)",2108,"Acyltransferase;Cell membrane;Complete proteome;Fatty acid metabolism;Lipid metabolism;Lipoprotein;Membrane;Multifunctional enzyme;NADP;Oxidoreductase;Palmitate;Phosphopantetheine;Phosphoprotein;Reference proteome;Signal;Transferase;Virulence",,"mtu:Rv1527c;mtv:RVBD_1527c;",,,,,,,,,,
"P9WH71","RIR2B_MYCTU","reviewed","nrdF2 Rv3048c","Ribonucleoside-diphosphate reductase subunit beta nrdF2 (EC 1.17.4.1) (Ribonucleoside-diphosphate reductase nrdF2) (Ribonucleotide reductase R2-2 small subunit)",324,"3D-structure;Complete proteome;DNA replication;Iron;Metal-binding;Oxidoreductase;Reference proteome","Ribonucleoside diphosphate reductase small chain family","mtu:Rv3048c;",,,,,,,,,,
"P9WGK7","PRRB_MYCTU","reviewed","prrB Rv0902c MTCY31.30c","Sensor-type histidine kinase PrrB (EC 2.7.13.3)",446,"3D-structure;ATP-binding;Cell membrane;Complete proteome;Kinase;Membrane;Nucleotide-binding;Phosphoprotein;Reference proteome;Transferase;Transmembrane;Transmembrane helix;Two-component regulatory system",,"mtu:Rv0902c;",,,,,,,,,,
"P9WPF1","PKS18_MYCTU","reviewed","pks18 Rv1372","Alpha-pyrone synthesis polyketide synthase-like Pks18 (EC 2.3.1.-) (Alpha-pyrone synthesis polyketide synthase type III Pks18) (Chalcone synthase-like protein) (CHS-like)",393,"3D-structure;Acyltransferase;Complete proteome;Fatty acid metabolism;Lipid metabolism;Reference proteome;Transferase","Chalcone/stilbene synthases family","mtu:Rv1372;",,,,,,,,,,
"P9WI61","PLSB_MYCTU","reviewed","plsB plsB2 Rv2482c MTV008.38c","Glycerol-3-phosphate acyltransferase (GPAT) (EC 2.3.1.15)",789,"Acyltransferase;Cell membrane;Complete proteome;Lipid biosynthesis;Lipid metabolism;Membrane;Phospholipid biosynthesis;Phospholipid metabolism;Reference proteome;Transferase","GPAT/DAPAT family","mtu:Rv2482c;",,,,,,,,,,
"P9WKD5","POLOX_MYCTU","reviewed","Rv2149c MTCY270.19","Polyphenol oxidase (EC 1.10.3.-) (Multicopper oxidase Rv2149c)",250,"Complete proteome;Copper;Metal-binding;Oxidoreductase;Reference proteome","Multicopper oxidase YfiH/RL5 family","mtu:Rv2149c;mtv:RVBD_2149c;",,,,,,,,,,
"O53493","PPMNT_MYCTU","reviewed","ppm1 lnt Rv2051c","Bifunctional apolipoprotein N-acyltransferase/polyprenol monophosphomannose synthase [Includes: Apolipoprotein N-acyltransferase (ALP N-acyltransferase) (EC 2.3.1.269); Polyprenol monophosphomannose synthase (PPM synthase) (Polyprenol-P-Man synthase) (Ppm1) (EC 2.4.1.-) (Dolichol-phosphate mannose synthase) (EC 2.4.1.83)]",874,"Acyltransferase;Cell membrane;Complete proteome;Glycosyltransferase;Hydrolase;Membrane;Reference proteome;Transferase;Transmembrane;Transmembrane helix","CN hydrolase family"," Apolipoprotein N-acyltransferase subfamily; Glycosyltransferase 2 family","mtu:Rv2051c;mtv:RVBD_2051c;",,,,,,,,,
"P9WQE7","PPSA_MYCTU","reviewed","ppsA Rv2931 MTCY338.20","Phthiocerol synthesis polyketide synthase type I PpsA (Beta-ketoacyl-acyl-carrier-protein synthase I) (EC 2.3.1.41)",1876,"Acetylation;Complete proteome;Fatty acid metabolism;Lipid metabolism;Multifunctional enzyme;NADP;Oxidoreductase;Phosphopantetheine;Phosphoprotein;Reference proteome;Repeat;Transferase",,"mtu:Rv2931;mtv:RVBD_2931;",,,,,,,,,,
"P9WQE5","PPSB_MYCTU","reviewed","ppsB Rv2932 MTCY338.21 MTV011.01","Phthiocerol synthesis polyketide synthase type I PpsB (Beta-ketoacyl-acyl-carrier-protein synthase I) (EC 2.3.1.41)",1538,"Complete proteome;Fatty acid metabolism;Lipid metabolism;Multifunctional enzyme;NADP;Oxidoreductase;Phosphopantetheine;Phosphoprotein;Reference proteome;Transferase",,"mtu:Rv2932;mtv:RVBD_2932;",,,,,,,,,,
"P96202","PPSC_MYCTU","reviewed","ppsC Rv2933","Phthiocerol synthesis polyketide synthase type I PpsC (Beta-ketoacyl-acyl-carrier-protein synthase I) (EC 2.3.1.41)",2188,"3D-structure;Acetylation;Complete proteome;Fatty acid metabolism;Lipid metabolism;Multifunctional enzyme;NADP;Oxidoreductase;Phosphopantetheine;Phosphoprotein;Reference proteome;Transferase",,"mtu:Rv2933;mtv:RVBD_2933;",,,,,,,,,,
"P9WQE3","PPSD_MYCTU","reviewed","ppsD Rv2934","Phthiocerol synthesis polyketide synthase type I PpsD (Beta-ketoacyl-acyl-carrier-protein synthase I) (EC 2.3.1.41)",1827,"Complete proteome;Fatty acid metabolism;Lipid metabolism;Multifunctional enzyme;NADP;Oxidoreductase;Phosphopantetheine;Phosphoprotein;Reference proteome;Transferase",,"mtu:Rv2934;",,,,,,,,,,
"P9WHS3","RIP1_MYCTU","reviewed","rip1 Rv2869c MTV003.15c","Zinc metalloprotease Rip1 (EC 3.4.24.-) (Regulator of sigma KLM proteases) (S2P endopeptidase) (Site-2 protease Rip1) (S2P protease Rip1) (Site-2-type intramembrane protease)",404,"Cell membrane;Complete proteome;Hydrolase;Membrane;Metal-binding;Metalloprotease;Protease;Reference proteome;Transmembrane;Transmembrane helix;Zinc","Peptidase M50B family","mtu:Rv2869c;",,,,,,,,,,
"L0T550","RIP2_MYCTU","reviewed","rip2 Rv0359","Putative zinc metalloprotease Rip2",259,"Cell membrane;Complete proteome;Hydrolase;Membrane;Metal-binding;Metalloprotease;Protease;Reference proteome;Transmembrane;Transmembrane helix;Zinc","Peptidase M50B family","mtu:Rv0359;",,,,,,,,,,
"P9WHR1","RIP3_MYCTU","reviewed","rip3 Rv2625c","Putative zinc metalloprotease Rip3",393,"CBS domain;Cell membrane;Complete proteome;Hydrolase;Membrane;Metal-binding;Metalloprotease;Protease;Reference proteome;Repeat;Transmembrane;Transmembrane helix;Zinc","Peptidase M50B family","mtu:Rv2625c;",,,,,,,,,,
"I6YG32","RIMI_MYCTU","reviewed","rimI Rv3420c LH57_18670","N-alpha-acetyltransferase RimI (EC 2.3.1.255) (EC 2.3.1.258)",158,"Acyltransferase;Complete proteome;Reference proteome;Transferase","Acetyltransferase family"," RimI subfamily","mtu:Rv3420c;mtv:RVBD_3420c;",,,,,,,,,
"P9WHN9","PHP_MYCTU","reviewed","php Rv0230c MTCY08D5.26c","Phosphotriesterase homology protein",326,"3D-structure;Complete proteome;Hydrolase;Metal-binding;Reference proteome;Zinc","Metallo-dependent hydrolases superfamily"," Phosphotriesterase family","mtu:Rv0230c;",,,,,,,,,
"P9WI95","PHOU2_MYCTU","reviewed","phoU2 phoY2 Rv0821c MTV043.13c","Phosphate-specific transport system accessory protein PhoU homolog 2 (Pst system accessory protein PhoU homolog 2)",213,"Complete proteome;Cytoplasm;Pharmaceutical;Phosphate transport;Reference proteome;Transport","PhoU family","mtu:Rv0821c;",,,,,,,,,,
"P9WPF5","PKS10_MYCTU","reviewed","pks10 Rv1660","Polyketide synthase-like Pks10 (EC 2.3.1.-) (Chalcone synthase-like protein) (CHS-like) (Polyketide synthase type III Pks10)",353,"Acyltransferase;Complete proteome;Fatty acid metabolism;Lipid metabolism;Reference proteome;Transferase","Chalcone/stilbene synthases family","mtu:Rv1660;",,,,,,,,,,
"P9WHF1","RIBBA_MYCTU","reviewed","ribBA ribA ribA2 Rv1415 MTCY21B4.33","Riboflavin biosynthesis protein RibBA [Includes: 3","4-dihydroxy-2-butanone 4-phosphate synthase (DHBP synthase) (EC 4.1.99.12); GTP cyclohydrolase-2 (EC 3.5.4.25) (GTP cyclohydrolase II)]",425,"Complete proteome;GTP-binding;Hydrolase;Lyase;Magnesium;Manganese;Metal-binding;Multifunctional enzyme;Nucleotide-binding;Reference proteome;Riboflavin biosynthesis;Zinc","DHBP synthase family; GTP cyclohydrolase II family","mtu:Rv1415;",,,,,,,,,
"P9WHU9","PROB_MYCTU","reviewed","proB Rv2439c MTCY428.07","Glutamate 5-kinase (EC 2.7.2.11) (Gamma-glutamyl kinase) (GK)",376,"ATP-binding;Amino-acid biosynthesis;Complete proteome;Cytoplasm;Kinase;Nucleotide-binding;Proline biosynthesis;Reference proteome;Transferase","Glutamate 5-kinase family","mtu:Rv2439c;",,,,,,,,,,
"P9WIM9","PR28_MYCTU","reviewed","mtc28 Rv0040c MTCY21D4.03c","Proline-rich 28 kDa antigen",310,"3D-structure;Complete proteome;Reference proteome;Signal",,"mtu:Rv0040c;",,,,,,,,,,
"P9WHV1","PROA_MYCTU","reviewed","proA Rv2427c MTCY428.20","Gamma-glutamyl phosphate reductase (GPR) (EC 1.2.1.41) (Glutamate-5-semialdehyde dehydrogenase) (Glutamyl-gamma-semialdehyde dehydrogenase) (GSA dehydrogenase)",415,"Acetylation;Amino-acid biosynthesis;Complete proteome;Cytoplasm;NADP;Oxidoreductase;Proline biosynthesis;Reference proteome","Gamma-glutamyl phosphate reductase family","mtu:Rv2427c;",,,,,,,,,,
"I6Y9Q3","PRPC_MYCTU","reviewed","prpC Rv1131 RVBD_1131 P425_01180","2-methylcitrate synthase (2-MCS) (MCS) (EC 2.3.3.5) (Citrate synthase) (EC 2.3.3.16)",393,"3D-structure;Complete proteome;Reference proteome;Transferase;Tricarboxylic acid cycle","Citrate synthase family","mtu:Rv1131;mtv:RVBD_1131;",,,,,,,,,,
"O06581","PRPR_MYCTU","reviewed","prpR Rv1129c RVBD_1129c P425_01178","HTH-type transcriptional regulator PrpR (Propionate regulator) (PRPR)",486,"Activator;Complete proteome;DNA-binding;Reference proteome;Repressor;Transcription;Transcription regulation","Short-chain fatty acyl-CoA assimilation regulator (ScfR) family","mtu:Rv1129c;mtv:RVBD_1129c;",,,,,,,,,,
"P9WHE1","RL13_MYCTU","reviewed","rplM Rv3443c MTCY77.15c","50S ribosomal protein L13",147,"3D-structure;Complete proteome;Reference proteome;Ribonucleoprotein;Ribosomal protein","Universal ribosomal protein uL13 family","mtu:Rv3443c;",,,,,,,,,,
"P9WHD9","RL14_MYCTU","reviewed","rplN Rv0714 MTCY210.33","50S ribosomal protein L14",122,"3D-structure;Complete proteome;RNA-binding;Reference proteome;Ribonucleoprotein;Ribosomal protein;rRNA-binding","Universal ribosomal protein uL14 family","mtu:Rv0714;",,,,,,,,,,
"P9WHN7","PTH_MYCTU","reviewed","pth Rv1014c MTCY10G2.35","Peptidyl-tRNA hydrolase (PTH) (EC 3.1.1.29)",191,"3D-structure;Complete proteome;Cytoplasm;Hydrolase;Reference proteome","PTH family","mtu:Rv1014c;",,,,,,,,,,
"P9WH75","RIR1_MYCTU","reviewed","nrdE Rv3051c MTV012.66c","Ribonucleoside-diphosphate reductase subunit alpha (EC 1.17.4.1) (Ribonucleotide reductase R1 subunit)",725,"ATP-binding;Allosteric enzyme;Complete proteome;DNA replication;Disulfide bond;Nucleotide-binding;Oxidoreductase;Reference proteome","Ribonucleoside diphosphate reductase large chain family","mtu:Rv3051c;",,,,,,,,,,
"P9WH73","RIR2A_MYCTU","reviewed","nrdF1 Rv1981c MTCY39.38","Ribonucleoside-diphosphate reductase subunit beta nrdF1 (EC 1.17.4.1) (Ribonucleotide reductase R2-1 small subunit) (Ribonucleotide reductase small subunit 1)",322,"Complete proteome;DNA replication;Iron;Metal-binding;Oxidoreductase;Reference proteome","Ribonucleoside diphosphate reductase small chain family","mtu:Rv1981c;",,,,,,,,,,
