"Entry","Entry name","Status","Gene names","product","Length","Keywords","Protein families","Cross-reference (KEGG)",,,,,,,,,,
"P9WP39","CUT3_MYCTU","reviewed","cut3 Rv3451 MTCY13E12.04","Probable cutinase cut3 (EC 3.1.1.74)",262,"Complete proteome;Disulfide bond;Hydrolase;Reference proteome;Secreted;Serine esterase;Signal","Cutinase family","mtu:Rv3451;",,,,,,,,,,
"P9WPF9","CDTS_MYCTU","reviewed","Rv2275","Cyclo(L-tyrosyl-L-tyrosyl) synthase (EC 2.3.2.21) (Cyclodipeptide synthase) (CDPS) (Cyclodityrosine synthase)",289,"3D-structure;Complete proteome;Reference proteome;Transferase","CDPS family","mtu:Rv2275;",,,,,,,,,,
"P9WIC1","CHMU_MYCTU","reviewed","Rv0948c MTCY10D7.26","Intracellular chorismate mutase (CM) (EC 5.4.99.5)",105,"3D-structure;Amino-acid biosynthesis;Aromatic amino acid biosynthesis;Complete proteome;Cytoplasm;Isomerase;Reference proteome",,"mtu:Rv0948c;mtv:RVBD_0948c;",,,,,,,,,,
"P9WG63","DIPZ_MYCTU","reviewed","dipZ Rv2874 MTCY274.05","Protein DipZ",695,"3D-structure;Cell membrane;Complete proteome;Membrane;Reference proteome;Transmembrane;Transmembrane helix",,"mtu:Rv2874;",,,,,,,,,,
"P9WNW5","DISA_MYCTU","reviewed","disA dacA Rv3586","DNA integrity scanning protein DisA (Cyclic-di-AMP synthase) (c-di-AMP synthase) (Diadenylate cyclase) (EC 2.7.7.85)",358,"ATP-binding;Complete proteome;DNA damage;DNA repair;DNA-binding;Magnesium;Manganese;Nucleotide-binding;Nucleotidyltransferase;Reference proteome;Transferase","DisA family","mtu:Rv3586;mtv:RVBD_3586;",,,,,,,,,,
"O50406","DITCY_MYCTU","reviewed","Rv3377c","Type B diterpene cyclase (EC 5.5.1.16)",501,"Complete proteome;Isomerase;Lyase;Magnesium;Metal-binding;Reference proteome","Terpene synthase family","mtu:Rv3377c;",,,,,,,,,,
"P9WHH9","DLDH_MYCTU","reviewed","lpdC lpd Rv0462 MTV038.06","Dihydrolipoyl dehydrogenase (LPD) (EC 1.8.1.4) (Component of peroxynitrite reductase/peroxidase complex) (Component of PNR/P) (Dihydrolipoamide dehydrogenase) (E3 component of alpha-ketoacid dehydrogenase complexes)",464,"3D-structure;Antioxidant;Complete proteome;Cytoplasm;Disulfide bond;FAD;Flavoprotein;Glycolysis;NAD;Oxidoreductase;Redox-active center;Reference proteome;Tricarboxylic acid cycle;Virulence","Class-I pyridine nucleotide-disulfide oxidoreductase family","mtu:Rv0462;",,,,,,,,,,
"P9WPM3","CP138_MYCTU","reviewed","cyp138 Rv0136 MTCI5.10","Putative cytochrome P450 138 (EC 1.14.-.-)",441,"Complete proteome;Heme;Iron;Metal-binding;Monooxygenase;Oxidoreductase;Reference proteome","Cytochrome P450 family","mtu:Rv0136;",,,,,,,,,,
"P9WNN1","EFTU_MYCTU","reviewed","tuf Rv0685 MTCY210.02","Elongation factor Tu (EF-Tu)",396,"Complete proteome;Cytoplasm;Elongation factor;GTP-binding;Nucleotide-binding;Protein biosynthesis;Reference proteome","TRAFAC class translation factor GTPase superfamily"," Classic translation factor GTPase family"," EF-Tu/EF-1A subfamily","mtu:Rv0685;",,,,,,,,
"P9WGD1","CPSY_MYCTU","reviewed","cpsY Rv0806c","Exopolysaccharide phosphotransferase CpsY (EC 2.7.-.-) (Stealth protein CpsY)",532,"Complete proteome;Exopolysaccharide synthesis;Reference proteome;Transferase","Stealth family","mtu:Rv0806c;",,,,,,,,,,
"L7N653","CWLM_MYCTU","reviewed","cwlM Rv3915","N-acetylmuramoyl-L-alanine amidase CwlM (EC 3.5.1.28) (Peptidoglycan hydrolase CwlM)",406,"Cell wall biogenesis/degradation;Complete proteome;Hydrolase;Periplasm;Reference proteome;Repeat","N-acetylmuramoyl-L-alanine amidase 3 family","mtu:Rv3915;mtv:RVBD_3915;",,,,,,,,,,
"P9WQ35","CYA1_MYCTU","reviewed","cya Rv1625c MTCY01B2.17c","Adenylate cyclase (EC 4.6.1.1) (ATP pyrophosphate-lyase) (Adenylyl cyclase)",443,"3D-structure;ATP-binding;Cell membrane;Complete proteome;Lyase;Magnesium;Manganese;Membrane;Metal-binding;Nucleotide-binding;Reference proteome;Transmembrane;Transmembrane helix;cAMP biosynthesis","Adenylyl cyclase class-4/guanylyl cyclase family","mtu:Rv1625c;",,,,,,,,,,
"P9WPL3","CP143_MYCTU","reviewed","cyp143 Rv1785c MTV049.07c","Putative cytochrome P450 143 (EC 1.14.-.-)",393,"Acetylation;Complete proteome;Heme;Iron;Metal-binding;Monooxygenase;Oxidoreductase;Reference proteome","Cytochrome P450 family","mtu:Rv1785c;",,,,,,,,,,
"P9WPP3","CP124_MYCTU","reviewed","cyp124 Rv2266 MTCY339.44c","Methyl-branched lipid omega-hydroxylase (EC 1.14.15.14) (Cholest-4-en-3-one C26-monooxygenase) (Cholest-4-en-3-one C26-monooxygenase [(25R)-3-oxocholest-4-en-26-oate forming]) (Cholesterol C26-monooxygenase) (Cholesterol C26-monooxygenase [(25R)-3beta-hydroxycholest-5-en-26-oate forming]) (Cytochrome P450 124) (Steroid C26-monooxygenase) (EC 1.14.15.28) (Steroid C27-monooxygenase)",428,"3D-structure;Complete proteome;Fatty acid metabolism;Heme;Iron;Lipid metabolism;Metal-binding;Monooxygenase;NADP;Oxidoreductase;Reference proteome","Cytochrome P450 family","mtu:Rv2266;",,,,,,,,,,
"O69670","EGTC_MYCTU","reviewed","egtC Rv3702c","Gamma-glutamyl-hercynylcysteine sulfoxide hydrolase (EC 3.5.1.118) (Gamma-glutamyl hercynylcysteine S-oxide hydrolase)",233,"Complete proteome;Glutamine amidotransferase;Hydrolase;Reference proteome",,"mtu:Rv3702c;",,,,,,,,,,
"P9WJG1","CSM2_MYCTU","reviewed","csm2 Rv2822c","CRISPR system Cms protein Csm2 (CRISPR type III A-associated protein Csm2)",124,"Antiviral defense;Complete proteome;RNA-binding;Reference proteome","CRISPR-associated Csm2 family","mtu:Rv2822c;",,,,,,,,,,
"P9WJF7","CSM4_MYCTU","reviewed","csm4 Rv2820c","CRISPR system Cms protein Csm4 (CRISPR type III-A associated RAMP protein Csm4)",302,"Antiviral defense;Complete proteome;RNA-binding;Reference proteome","CRISPR-associated Csm4 family","mtu:Rv2820c;",,,,,,,,,,
"P9WJF5","CSM5_MYCTU","reviewed","csm5 Rv2819c","CRISPR system Cms protein Csm5 (CRISPR type III A-associated protein Csm5)",375,"Antiviral defense;Complete proteome;RNA-binding;Reference proteome","CRISPR-associated Csm5 family","mtu:Rv2819c;",,,,,,,,,,
"P9WP49","CSOR_MYCTU","reviewed","csoR croR Rv0967","Copper-sensing transcriptional repressor CsoR (Copper-sensitive operon repressor)",119,"3D-structure;Complete proteome;Copper;Cytoplasm;DNA-binding;Metal-binding;Reference proteome;Repressor;Transcription;Transcription regulation","CsoR family","mtu:Rv0967;",,,,,,,,,,
"P9WPP9","CP51_MYCTU","reviewed","cyp51 Rv0764c MTCY369.09c","Lanosterol 14-alpha demethylase (EC 1.14.14.154) (CYPLI) (Cytochrome P450 51) (Cytochrome P450-14DM) (Cytochrome P450-LIA1) (Sterol 14-alpha demethylase)",451,"3D-structure;Complete proteome;Cytoplasm;Heme;Iron;Lipid biosynthesis;Lipid metabolism;Metal-binding;Monooxygenase;Oxidoreductase;Reference proteome;Steroid biosynthesis;Steroid metabolism;Sterol biosynthesis;Sterol metabolism","Cytochrome P450 family","mtu:Rv0764c;",,,,,,,,,,
"P9WP47","CSTA_MYCTU","reviewed","cstA Rv3063 MTCY22D7.18c","Peptide transporter CstA (Carbon starvation protein A homolog)",758,"Cell membrane;Complete proteome;Membrane;Peptide transport;Protein transport;Reference proteome;Transmembrane;Transmembrane helix;Transport","Peptide transporter carbon starvation (CstA) (TC 2.A.114) family","mtu:Rv3063;",,,,,,,,,,
"P9WPS7","CTPG_MYCTU","reviewed","ctpG Rv1992c MTCY39.27","Probable cation-transporting ATPase G (EC 3.6.3.-)",771,"ATP-binding;Cell membrane;Complete proteome;Hydrolase;Magnesium;Membrane;Metal-binding;Nucleotide-binding;Reference proteome;Transmembrane;Transmembrane helix","Cation transport ATPase (P-type) (TC 3.A.3) family"," Type IB subfamily","mtu:Rv1992c;",,,,,,,,,
"P9WPU1","CTPA_MYCTU","reviewed","ctpA Rv0092 MTCY251.11","Copper-exporting P-type ATPase (EC 7.2.2.8) (Copper-exporting P-type ATPase A)",761,"ATP-binding;Acetylation;Cell membrane;Complete proteome;Copper;Copper transport;Ion transport;Membrane;Metal-binding;Nucleotide-binding;Reference proteome;Translocase;Transmembrane;Transmembrane helix;Transport","Cation transport ATPase (P-type) (TC 3.A.3) family"," Type IB subfamily","mtu:Rv0092;",,,,,,,,,
"P9WP43","CUT1_MYCTU","reviewed","Rv1984c MTCY39.35","Probable cutinase Rv1984c (EC 3.1.1.74)",217,"Complete proteome;Disulfide bond;Hydrolase;Reference proteome;Secreted;Serine esterase;Signal","Cutinase family","mtu:Rv1984c;",,,,,,,,,,
"P9WQM1","CYSA_MYCTU","reviewed","cysA Rv2397c MTCY253.24","Sulfate/thiosulfate import ATP-binding protein CysA (EC 7.3.2.3) (Sulfate-transporting ATPase)",351,"ATP-binding;Acetylation;Cell membrane;Complete proteome;Membrane;Nucleotide-binding;Reference proteome;Sulfate transport;Translocase;Transport","ABC transporter superfamily"," Sulfate/tungstate importer (TC 3.A.1.6) family","mtu:Rv2397c;",,,,,,,,,
"P9WPT3","CTPD_MYCTU","reviewed","ctpD Rv1469 MTV007.16","Probable cobalt/nickel-exporting P-type ATPase (EC 3.6.3.-) (Cation-transporting P-type ATPase CtpD)",657,"ATP-binding;Cell membrane;Cobalt;Complete proteome;Hydrolase;Magnesium;Membrane;Metal-binding;Nickel;Nucleotide-binding;Phosphoprotein;Reference proteome;Transmembrane;Transmembrane helix","Cation transport ATPase (P-type) (TC 3.A.3) family"," Type IB subfamily","mtu:Rv1469;",,,,,,,,,
"P9WPT1","CTPE_MYCTU","reviewed","ctpE Rv0908 MTCY21C12.02","Calcium-transporting ATPase CtpE (EC 7.2.2.10)",797,"ATP-binding;Calcium;Calcium transport;Cell membrane;Complete proteome;Ion transport;Magnesium;Membrane;Metal-binding;Nucleotide-binding;Reference proteome;Translocase;Transmembrane;Transmembrane helix;Transport","Cation transport ATPase (P-type) (TC 3.A.3) family","mtu:Rv0908;",,,,,,,,,,
"P9WPT7","CTPJ_MYCTU","reviewed","ctpJ nmtA Rv3743c","Probable cation-transporting P-type ATPase J (EC 3.6.3.-)",660,"ATP-binding;Cell membrane;Complete proteome;Hydrolase;Magnesium;Membrane;Metal-binding;Nucleotide-binding;Phosphoprotein;Reference proteome;Transmembrane;Transmembrane helix","Cation transport ATPase (P-type) (TC 3.A.3) family"," Type IB subfamily","mtu:Rv3743c;",,,,,,,,,
"P9WPT5","CTPC_MYCTU","reviewed","ctpC mtaA Rv3270 MTCY71.10","Manganese-exporting P-type ATPase (EC 3.6.3.-) (Cation-transporting P-type ATPase CtpC) (Metal-transporting ATPase Mta72)",718,"ATP-binding;Cell membrane;Complete proteome;Hydrolase;Magnesium;Manganese;Membrane;Metal-binding;Nucleotide-binding;Reference proteome;Transmembrane;Transmembrane helix;Virulence","Cation transport ATPase (P-type) (TC 3.A.3) family"," Type IB subfamily","mtu:Rv3270;",,,,,,,,,
"P9WFR7","COXX_MYCTU","reviewed","ctaB Rv1451","Protoheme IX farnesyltransferase (EC 2.5.1.141) (Heme B farnesyltransferase) (Heme O synthase)",308,"Cell membrane;Complete proteome;Heme biosynthesis;Membrane;Reference proteome;Transferase;Transmembrane;Transmembrane helix","UbiA prenyltransferase family"," Protoheme IX farnesyltransferase subfamily","mtu:Rv1451;",,,,,,,,,
"P9WPS9","CTPF_MYCTU","reviewed","ctpF Rv1997 MTCY39.21c MTCY39.22c","Probable cation-transporting ATPase F (EC 3.6.3.-)",905,"ATP-binding;Cell membrane;Complete proteome;Hydrolase;Magnesium;Membrane;Metal-binding;Nucleotide-binding;Reference proteome;Transmembrane;Transmembrane helix","Cation transport ATPase (P-type) (TC 3.A.3) family"," Type IIA subfamily","mtu:Rv1997;",,,,,,,,,
"P9WPS5","CTPI_MYCTU","reviewed","ctpI Rv0107c MTCY251.26c","Probable cation-transporting ATPase I (EC 3.6.3.-)",1632,"ATP-binding;Cell membrane;Complete proteome;Hydrolase;Magnesium;Membrane;Metal-binding;Nucleotide-binding;Reference proteome;Transmembrane;Transmembrane helix","Cation transport ATPase (P-type) (TC 3.A.3) family","mtu:Rv0107c;",,,,,,,,,,
"P9WPT9","CTPB_MYCTU","reviewed","ctpB Rv0103c MTCY251.22c","Cation-transporting P-type ATPase B (EC 3.6.3.-)",752,"ATP-binding;Cell membrane;Complete proteome;Hydrolase;Magnesium;Membrane;Metal-binding;Nucleotide-binding;Reference proteome;Transmembrane;Transmembrane helix","Cation transport ATPase (P-type) (TC 3.A.3) family"," Type IB subfamily","mtu:Rv0103c;",,,,,,,,,
"P9WNL7","EMBB_MYCTU","reviewed","embB Rv3795 MTCY13D12.29","Probable arabinosyltransferase B (EC 2.4.2.-)",1098,"Antibiotic resistance;Cell membrane;Cell wall biogenesis/degradation;Complete proteome;Glycosyltransferase;Membrane;Reference proteome;Transferase;Transmembrane;Transmembrane helix","Emb family","mtu:Rv3795;",,,,,,,,,,
"P9WG89","EMRB_MYCTU","reviewed","emrB Rv0783c","Multidrug resistance protein B homolog",540,"Cell membrane;Complete proteome;Membrane;Reference proteome;Transmembrane;Transmembrane helix;Transport","Major facilitator superfamily"," EmrB family","mtu:Rv0783c;",,,,,,,,,
"P9WP41","CUT2_MYCTU","reviewed","cut2 Rv2301 MTCY339.08c","Probable cutinase cut2 (EC 3.1.1.74)",230,"Complete proteome;Disulfide bond;Hydrolase;Reference proteome;Secreted;Serine esterase;Signal","Cutinase family","mtu:Rv2301;",,,,,,,,,,
"P9WQ11","END3_MYCTU","reviewed","nth Rv3674c MTV025.022c","Endonuclease III (EC 4.2.99.18) (DNA-(apurinic or apyrimidinic site) lyase)",245,"4Fe-4S;Complete proteome;DNA damage;DNA repair;DNA-binding;Glycosidase;Hydrolase;Iron;Iron-sulfur;Lyase;Metal-binding;Multifunctional enzyme;Reference proteome","Nth/MutY family","mtu:Rv3674c;mtv:RVBD_3674c;",,,,,,,,,,
"P9WQ13","END4_MYCTU","reviewed","end nfo Rv0670 MTCI376.04c","Probable endonuclease 4 (EC 3.1.21.2) (Endodeoxyribonuclease IV) (Endonuclease IV)",252,"3D-structure;Complete proteome;DNA damage;DNA repair;Endonuclease;Hydrolase;Metal-binding;Nuclease;Reference proteome;Zinc","AP endonuclease 2 family","mtu:Rv0670;",,,,,,,,,,
"P9WJF3","CWSA_MYCTU","reviewed","cwsA Rv0008c MTCY10H4.07c","Cell wall synthesis protein CwsA (Cell wall synthesis and cell shape protein A)",145,"Cell cycle;Cell division;Cell membrane;Cell shape;Complete proteome;Membrane;Reference proteome;Transmembrane;Transmembrane helix","CwsA family","mtu:Rv0008c;",,,,,,,,,,
"P9WNB9","END8A_MYCTU","reviewed","nei1 nei2 Rv2464c MTV008.20c","Endonuclease 8 1 (DNA glycosylase/AP lyase Nei 1) (EC 3.2.2.-) (DNA-(apurinic or apyrimidinic site) lyase Nei 1) (EC 4.2.99.18) (Endonuclease VIII 1)",268,"Complete proteome;DNA damage;DNA repair;DNA-binding;Glycosidase;Hydrolase;Lyase;Metal-binding;Multifunctional enzyme;Reference proteome;Zinc;Zinc-finger","FPG family","mtu:Rv2464c;",,,,,,,,,,
"P9WNC1","END8B_MYCTU","reviewed","nei2 nei1 Rv3297 MTCY71.37","Endonuclease 8 2 (DNA glycosylase/AP lyase Nei 2) (EC 3.2.2.-) (DNA-(apurinic or apyrimidinic site) lyase Nei 2) (EC 4.2.99.18) (Endonuclease VIII 2)",255,"Complete proteome;DNA damage;DNA repair;DNA-binding;Glycosidase;Hydrolase;Lyase;Metal-binding;Multifunctional enzyme;Reference proteome;Zinc;Zinc-finger","FPG family","mtu:Rv3297;",,,,,,,,,,
"P9WP67","COX3_MYCTU","reviewed","ctaE Rv2193 MTCY190.04","Probable cytochrome c oxidase subunit 3 (EC 1.9.3.1) (Cytochrome aa3 subunit 3) (Cytochrome c oxidase polypeptide III)",203,"Acetylation;Cell membrane;Complete proteome;Membrane;Oxidoreductase;Reference proteome;Transmembrane;Transmembrane helix","Cytochrome c oxidase subunit 3 family","mtu:Rv2193;",,,,,,,,,,
"P9WPN9","CP126_MYCTU","reviewed","cyp126 Rv0778 MTCY369.22","Putative cytochrome P450 126 (EC 1.14.-.-)",414,"3D-structure;Complete proteome;Heme;Iron;Metal-binding;Monooxygenase;Oxidoreductase;Reference proteome","Cytochrome P450 family","mtu:Rv0778;",,,,,,,,,,
"P9WPM7","CP136_MYCTU","reviewed","cyp136 Rv3059 MTCY22D7.22c","Putative cytochrome P450 136 (EC 1.14.-.-)",492,"Acetylation;Complete proteome;Heme;Iron;Metal-binding;Monooxygenase;Oxidoreductase;Reference proteome","Cytochrome P450 family","mtu:Rv3059;",,,,,,,,,,
"P9WG69","FADA4_MYCTU","reviewed","fadA4 Rv1323 MTCY130.08","Probable acetyl-CoA acetyltransferase (EC 2.3.1.9) (Acetoacetyl-CoA thiolase)",389,"Acyltransferase;Complete proteome;Reference proteome;Transferase","Thiolase family","mtu:Rv1323;mtv:RVBD_1323;",,,,,,,,,,
"I6XHI4","FADA5_MYCTU","reviewed","fadA5 LH57_19345 Rv3546","Steroid 3-ketoacyl-CoA thiolase (EC 2.3.1.16) (Acetyl-CoA acetyltransferase FadA5) (Beta-ketoacyl-CoA thiolase)",391,"3D-structure;Acyltransferase;Cholesterol metabolism;Complete proteome;Lipid degradation;Lipid metabolism;Reference proteome;Steroid metabolism;Sterol metabolism;Transferase;Virulence","Thiolase family","mtu:Rv3546;mtv:RVBD_3546;",,,,,,,,,,
"P9WP27","DAO_MYCTU","reviewed","aao Rv1905c","Probable D-amino-acid oxidase (DAAO) (DAMOX) (DAO) (EC 1.4.3.3)",320,"Complete proteome;FAD;Flavoprotein;Oxidoreductase;Reference proteome","DAMOX/DASOX family","mtu:Rv1905c;mtv:RVBD_1905c;",,,,,,,,,,
"P95231","CYSE_MYCTU","reviewed","cysE Rv2335","Serine acetyltransferase (SAT) (EC 2.3.1.30)",229,"Acyltransferase;Amino-acid biosynthesis;Complete proteome;Cysteine biosynthesis;Cytoplasm;Reference proteome;Repeat;Transferase","Transferase hexapeptide repeat family","mtu:Rv2335;",,,,,,,,,,
"P96843","FAD3_MYCTU","reviewed","fadD3 Rv3561 P425_03703 RVBD_3561","3-[(3aS","4S","7aS)-7a-methyl-1","5-dioxo-octahydro-1H-inden-4-yl]propanoyl:CoA ligase (HIP:CoA ligase) (EC 6.2.1.41)",507,"ATP-binding;Cholesterol metabolism;Complete proteome;Ligase;Lipid metabolism;Nucleotide-binding;Reference proteome;Steroid metabolism;Sterol metabolism","ATP-dependent AMP-binding enzyme family","mtu:Rv3561;",,,,,,,
"P9WP55","CYSK_MYCTU","reviewed","cysK1 cysK Rv2334 MTCY98.03","O-acetylserine sulfhydrylase (OAS sulfhydrylase) (OASS) (EC 2.5.1.47) (Cysteine synthase A) (CSase A) (O-acetylserine (thiol)-lyase A) (OAS-TL A) (O-acetylserine-specific cysteine synthase) (Sulfide-dependent cysteine synthase)",310,"3D-structure;Amino-acid biosynthesis;Complete proteome;Cysteine biosynthesis;Pyridoxal phosphate;Reference proteome;Transferase","Cysteine synthase/cystathionine beta-synthase family","mtu:Rv2334;",,,,,,,,,,
"P9WP29","DAGK_MYCTU","reviewed","dagK Rv2252","Diacylglycerol kinase (DAG kinase) (DAGK) (EC 2.7.1.107)",309,"ATP-binding;Cell wall;Complete proteome;Kinase;Lipid biosynthesis;Lipid metabolism;Magnesium;Metal-binding;Nucleotide-binding;Phospholipid biosynthesis;Phospholipid metabolism;Reference proteome;Secreted;Transferase","Diacylglycerol/lipid kinase family","mtu:Rv2252;",,,,,,,,,,
"P9WKL1","IDH_MYCTU","reviewed","icd Rv3339c MTV016.39c","Isocitrate dehydrogenase [NADP] (IDH) (EC 1.1.1.42) (IDP) (NADP(+)-specific ICDH) (Oxalosuccinate decarboxylase)",409,"3D-structure;Complete proteome;Glyoxylate bypass;Magnesium;Manganese;Metal-binding;NADP;Oxidoreductase;Phosphoprotein;Reference proteome;Tricarboxylic acid cycle","Isocitrate and isopropylmalate dehydrogenases family","mtu:Rv3339c;mtv:RVBD_3339c;",,,,,,,,,,
"P9WIP7","LSR2_MYCTU","reviewed","lsr2 Rv3597c MTCY07H7B.25","Nucleoid-associated protein Lsr2",112,"3D-structure;Complete proteome;Cytoplasm;DNA-binding;Reference proteome;Repressor;Transcription;Transcription regulation;Virulence","Lsr2 family","mtu:Rv3597c;",,,,,,,,,,
"P9WG39","ILVG_MYCTU","reviewed","ilvG Rv1820 MTCY1A11.23c","Acetolactate synthase large subunit IlvG (ALS) (EC 2.2.1.6) (Acetohydroxy-acid synthase large subunit) (AHAS)",547,"Acetylation;Amino-acid biosynthesis;Branched-chain amino acid biosynthesis;Complete proteome;FAD;Flavoprotein;Magnesium;Metal-binding;Reference proteome;Thiamine pyrophosphate;Transferase","TPP enzyme family","mtu:Rv1820;",,,,,,,,,,
"P9WKJ3","ILVH_MYCTU","reviewed","ilvH ilvN Rv3002c MTV012.16c","Putative acetolactate synthase small subunit (EC 2.2.1.6) (Acetohydroxy-acid synthase small subunit) (AHAS) (ALS)",168,"Amino-acid biosynthesis;Branched-chain amino acid biosynthesis;Complete proteome;Isopeptide bond;Reference proteome;Transferase;Ubl conjugation","Acetolactate synthase small subunit family","mtu:Rv3002c;",,,,,,,,,,
"P9WQJ7","IRTB_MYCTU","reviewed","irtB Rv1349 MTCY02B10.13","Iron import ATP-binding/permease protein IrtB (EC 3.6.3.-) (Iron-regulated transporter B)",579,"ATP-binding;Cell membrane;Complete proteome;Hydrolase;Membrane;Nucleotide-binding;Reference proteome;Transmembrane;Transmembrane helix;Transport","ABC transporter superfamily"," Siderophore-Fe(3+) uptake transporter (SIUT) (TC 3.A.1.21) family","mtu:Rv1349;",,,,,,,,,
"P9WJ83","MCTB_MYCTU","reviewed","mctB Rv1698 MTCI125.20","Copper transporter MctB (Mycobacterial copper transport protein B)",314,"Cell outer membrane;Complete proteome;Copper;Ion transport;Membrane;Porin;Reference proteome;Signal;Transmembrane;Transport","MctB (TC 1.B.50) family","mtu:Rv1698;",,,,,,,,,,
"P95251","MCE3R_MYCTU","reviewed","mce3R Rv1963c LH57_10685","Transcriptional repressor Mce3R (TetR family transcriptional regulator)",406,"Complete proteome;DNA-binding;Lipid degradation;Lipid metabolism;Reference proteome;Repeat;Repressor;Transcription;Transcription regulation",,"mtu:Rv1963c;mtv:RVBD_1963c;",,,,,,,,,,
"O53838","KMTR_MYCTU","reviewed","kmtR Rv0827c","HTH-type transcriptional regulator KmtR",130,"Complete proteome;DNA-binding;Reference proteome;Repressor;Transcription;Transcription regulation",,"mtu:Rv0827c;mtv:RVBD_0827c;",,,,,,,,,,
"O53182","KORA_MYCTU","reviewed","korA Rv2455c","2-oxoglutarate oxidoreductase subunit KorA (EC 1.2.7.3) (Alpha-ketoglutarate oxidoreductase subunit alpha/gamma) (KG oxidoreductase subunit alpha/gamma) (KGO subunit alpha/gamma) (KOR subunit alpha/gamma)",653,"Complete proteome;Oxidoreductase;Reference proteome;Tricarboxylic acid cycle",,"mtu:Rv2455c;mtv:RVBD_2455c;",,,,,,,,,,
"O53181","KORB_MYCTU","reviewed","korB Rv2454c","2-oxoglutarate oxidoreductase subunit KorB (EC 1.2.7.3) (Alpha-ketoglutarate oxidoreductase subunit beta) (KG oxidoreductase subunit beta) (KGO subunit beta) (KOR subunit beta)",373,"Complete proteome;Magnesium;Oxidoreductase;Reference proteome;Tricarboxylic acid cycle",,"mtu:Rv2454c;mtv:RVBD_2454c;",,,,,,,,,,
"P9WJP3","MENC_MYCTU","reviewed","menC Rv0553 MTCY25D10.32","o-succinylbenzoate synthase (OSB synthase) (OSBS) (EC 4.2.1.113) (4-(2'-carboxyphenyl)-4-oxybutyric acid synthase) (o-succinylbenzoic acid synthase)",326,"Complete proteome;Lyase;Magnesium;Menaquinone biosynthesis;Metal-binding;Reference proteome","Mandelate racemase/muconate lactonizing enzyme family"," MenC type 1 subfamily","mtu:Rv0553;",,,,,,,,,
"P9WQ39","MENE_MYCTU","reviewed","menE Rv0542c","Probable 2-succinylbenzoate--CoA ligase (EC 6.2.1.26) (OSB-CoA synthetase) (o-succinylbenzoyl-CoA synthetase)",370,"ATP-binding;Complete proteome;Ligase;Menaquinone biosynthesis;Nucleotide-binding;Reference proteome","ATP-dependent AMP-binding enzyme family"," MenE subfamily","mtu:Rv0542c;",,,,,,,,,
"P9WFW9","MENF_MYCTU","reviewed","menF entC Rv3215","Putative isochorismate synthase MenF (EC 5.4.4.2) (Isochorismate mutase)",372,"Complete proteome;Isomerase;Magnesium;Menaquinone biosynthesis;Metal-binding;Reference proteome","Isochorismate synthase family","mtu:Rv3215;",,,,,,,,,,
"P9WKE1","KTHY_MYCTU","reviewed","tmk Rv3247c","Thymidylate kinase (EC 2.7.4.9) (Thymidine monophosphate kinase) (dTMP kinase) (TMPK)",214,"3D-structure;ATP-binding;Complete proteome;Direct protein sequencing;Kinase;Magnesium;Metal-binding;Nucleotide biosynthesis;Nucleotide-binding;Reference proteome;Transferase","Thymidylate kinase family","mtu:Rv3247c;",,,,,,,,,,
"P9WKD9","KU_MYCTU","reviewed","mku Rv0937c","Non-homologous end joining protein Ku (Mt-Ku)",273,"Complete proteome;DNA damage;DNA recombination;DNA repair;DNA-binding;Reference proteome","Prokaryotic Ku family","mtu:Rv0937c;",,,,,,,,,,
"P9WKE7","KHSE_MYCTU","reviewed","thrB Rv1296 MTCY373.16","Homoserine kinase (HK) (HSK) (EC 2.7.1.39)",316,"ATP-binding;Amino-acid biosynthesis;Complete proteome;Cytoplasm;Kinase;Nucleotide-binding;Reference proteome;Threonine biosynthesis;Transferase","GHMP kinase family"," Homoserine kinase subfamily","mtu:Rv1296;",,,,,,,,,
"P9WMB9","KSTR2_MYCTU","reviewed","kstR2 Rv3557c","HTH-type transcriptional repressor KstR2",200,"3D-structure;Complete proteome;DNA-binding;Reference proteome;Repressor;Transcription;Transcription regulation",,"mtu:Rv3557c;",,,,,,,,,,
"P96856","KSTR_MYCTU","reviewed","kstR Rv3574","HTH-type transcriptional repressor KstR",220,"3D-structure;Complete proteome;DNA-binding;Reference proteome;Repressor;Transcription;Transcription regulation",,"mtu:Rv3574;",,,,,,,,,,
"P71875","KSHA_MYCTU","reviewed","kshA Rv3526","3-ketosteroid-9-alpha-monooxygenase"," oxygenase component (3-ketosteroid-9-alpha-hydroxylase"," oxygenase component) (KSH) (Androsta-1","4-diene-3","17-dione 9-alpha-hydroxylase) (EC 1.14.15.30) (Rieske-type oxygenase) (RO)",386,"2Fe-2S;3D-structure;Cholesterol metabolism;Complete proteome;Iron;Iron-sulfur;Lipid degradation;Lipid metabolism;Metal-binding;Oxidoreductase;Reference proteome;Steroid metabolism;Sterol metabolism;Virulence",,"mtu:Rv3526;",,,,,,
"P9WPA9","KCY_MYCTU","reviewed","cmk Rv1712 MTCI125.34","Cytidylate kinase (CK) (EC 2.7.4.25) (Cytidine monophosphate kinase) (CMP kinase)",230,"ATP-binding;Complete proteome;Cytoplasm;Direct protein sequencing;Kinase;Nucleotide-binding;Reference proteome;Transferase","Cytidylate kinase family"," Type 1 subfamily","mtu:Rv1712;",,,,,,,,,
"P9WQ77","LAT_MYCTU","reviewed","lat Rv3290c MTCY71.30","Probable L-lysine-epsilon aminotransferase (L-lysine aminotransferase) (EC 2.6.1.36) (Lysine 6-aminotransferase)",449,"3D-structure;Aminotransferase;Complete proteome;Pyridoxal phosphate;Reference proteome;Transferase","Class-III pyridoxal-phosphate-dependent aminotransferase family","mtu:Rv3290c;",,,,,,,,,,
"P9WJ93","KSHB_MYCTU","reviewed","hmp kshB Rv3571","3-ketosteroid-9-alpha-monooxygenase"," ferredoxin reductase component (3-ketosteroid-9-alpha-hydroxylase"," ferredoxin reductase component) (KSH) (Androsta-1","4-diene-3","17-dione 9-alpha-hydroxylase) (EC 1.14.15.30) (Rieske-type oxygenase) (RO)",358,"2Fe-2S;Cholesterol metabolism;Complete proteome;FAD;Flavoprotein;Iron;Iron-sulfur;Lipid degradation;Lipid metabolism;Metal-binding;Oxidoreductase;Reference proteome;Steroid metabolism;Sterol metabolism;Virulence",,"mtu:Rv3571;",,,,,,
"P9WKE5","KPYK_MYCTU","reviewed","pyk pykA Rv1617 MTCY01B2.09","Pyruvate kinase (PK) (EC 2.7.1.40)",472,"3D-structure;ATP-binding;Complete proteome;Glycolysis;Kinase;Magnesium;Metal-binding;Nucleotide-binding;Phosphoprotein;Potassium;Pyruvate;Reference proteome;Transferase","Pyruvate kinase family","mtu:Rv1617;",,,,,,,,,,
